<?xml version="1.0" encoding="UTF-8"?>
<Columns xmlns:xsi="http://www.w3.org/2001/XMLSchema-instance"
    xsi:noNamespaceSchemaLocation="column_rules.xsd">
    <IncomeColumns>
        <Column>
            <ColumnName>Misc.</ColumnName>
            <GSTIncluded>N</GSTIncluded>
        </Column>
        <Column>
            <ColumnName>Wages</ColumnName>
            <GSTIncluded>Y</GSTIncluded>
            <Values>
                <Value>Salary</Value>
            </Values>
        </Column>
        <Column>
            <ColumnName>Pay me Back</ColumnName>
            <GSTIncluded>N</GSTIncluded>
            <Values>
                <Value>Damien</Value>
                <Value>Zhijie</Value>
            </Values>
        </Column>
        <Column>
            <ColumnName>Tax Refund</ColumnName>
            <GSTIncluded>N</GSTIncluded>
            <Values>
                <Value>ATO</Value>
            </Values>
        </Column>
        <Column>
            <ColumnName>Transfers</ColumnName>
            <GSTIncluded>N</GSTIncluded>
            <Values>
                <Value>xx6079</Value>
            </Values>
        </Column>
        <Column>
            <ColumnName>Transfers from Family</ColumnName>
            <GSTIncluded>N</GSTIncluded>
            <Values>
                <Value>QiQiong</Value>
                <Value>Zhi Kang</Value>
                <Value>Mastercard Autopay</Value>
            </Values>
        </Column>
    </IncomeColumns>
    <ExpenseColumns>
        <Column>
            <ColumnName>With Friends</ColumnName>
            <GSTIncluded>N</GSTIncluded>
            <Values>
                <Value>UBER</Value>
                <Value>MANGO</Value>
                <Value>LINDOS</Value>
                <Value>ZJ</Value>
                <Value>Bday</Value>
                <Value>Truman</Value>
                <Value>Zhijie</Value>
                <Value>Universal</Value>
                <Value>SIRDUKE</Value>
            </Values>
        </Column>
        <Column>
            <ColumnName>Takeaway for Work</ColumnName>
            <GSTIncluded>Y</GSTIncluded>
            <Values>
                <Value>HERO SUSHI</Value>
                <Value>MIGHTY</Value>
                <Value>MCDONALDS</Value>
                <Value>ZEUS</Value>
                <Value>NOODLEBOX</Value>
                <Value>TOP NOTCH</Value>
                <Value>HUNKY DORY</Value>
            </Values>
        </Column>
        <Column>
            <ColumnName>Groceries</ColumnName>
            <GSTIncluded>N</GSTIncluded>
            <Values>
                <Value>WOOLWORTHS</Value>
                <Value>COLES</Value>
                <Value>CHEMWAREHS</Value>
                <Value>SUPAIGA</Value>
                <Value>KMART</Value>
            </Values>
        </Column>
        <Column>
            <ColumnName>Subscriptions</ColumnName>
            <GSTIncluded>N</GSTIncluded>
            <Values>
                <Value>Optus</Value>
                <Value>Crunchyroll</Value>
                <Value>Spotify</Value>
            </Values>
        </Column>
        <Column>
            <ColumnName>Transport</ColumnName>
            <GSTIncluded>Y</GSTIncluded>
            <Values>
                <Value>EG GROUP</Value>
                <Value>MYKI</Value>
                <Value>TOYOTA</Value>
                <Value>EASTLINK</Value>
                <Value>PAYSTAY</Value>
                <Value>VICROADS</Value>
                <Value>7-ELEVEN</Value>
            </Values>
        </Column>
        <Column>
            <ColumnName>Games</ColumnName>
            <GSTIncluded>N</GSTIncluded>
            <Values>
                <Value>Nintendo</Value>
            </Values>
        </Column>        
        <Column>
            <ColumnName>Merch</ColumnName>
            <GSTIncluded>N</GSTIncluded>
        </Column>
        <Column>
            <ColumnName>Clothes</ColumnName>
            <GSTIncluded>N</GSTIncluded>
            <Values>
                <Value>DAVIECLOTHI</Value>
                <Value>Uniqlo</Value>
            </Values>
        </Column>
        <Column>
            <ColumnName>Tech</ColumnName>
            <GSTIncluded>N</GSTIncluded>
            <Values>
                <Value>SCORPIONTEC</Value>
                <Value>OFFICEWORKS</Value>
                <Value>KOGAN</Value>
                <Value>DICKSMITH</Value>
                <Value>JB HI-FI</Value>
            </Values>
        </Column>
        <Column>
            <ColumnName>Transfers</ColumnName>
            <GSTIncluded>Y</GSTIncluded>
            <Values>
                <Value>Mastercard Autopay</Value>
                <Value>xx6079</Value>
            </Values>
        </Column>
        <Column>
            <ColumnName>Transfers to Family</ColumnName>
            <GSTIncluded>Y</GSTIncluded>
            <Values>
                <Value>BUSINESS TRANS</Value>
                <Value>EVERYDAY OFFSET</Value>
            </Values>
        </Column>
        <Column>
            <ColumnName>Business Expenditure</ColumnName>
            <GSTIncluded>Y</GSTIncluded>
            <Values>
                <Value>ASIC</Value>
                <Value>REPCO</Value>
            </Values>
        </Column>
        <Column>
            <ColumnName>Education</ColumnName>
            <GSTIncluded>N</GSTIncluded>
            <Values>
                <Value>PEGS</Value>
                <Value>CAMPION</Value>
            </Values>
        </Column>
        <Column>
            <ColumnName>Family</ColumnName>
            <GSTIncluded>Y</GSTIncluded>
            <Values>
                <Value>GOLD LEAF</Value>
                <Value>ARLBERG</Value>
                <Value>MOUNT BULLER</Value>
                <Value>SKI HIRE</Value>
                <Value>EUROA</Value>
                <Value>FAMILY DNTL</Value>
                <Value>CENTRELINK</Value>
            </Values>
        </Column>        
        <Column>
            <ColumnName>Utilities</ColumnName>
            <GSTIncluded>N</GSTIncluded>
            <Values>
                <Value>Yarra Valley</Value>
            </Values>
        </Column>
        <Column>
            <ColumnName>Misc.</ColumnName>
            <GSTIncluded>N</GSTIncluded>
        </Column>
    </ExpenseColumns>
</Columns>