<?xml version="1.0" encoding="UTF-8"?>
<Columns xmlns:xsi="http://www.w3.org/2001/XMLSchema-instance"
 xsi:noNamespaceSchemaLocation="column_rules.xsd">
    <IncomeColumns>
        <Column>
            <ColumnName>Misc.</ColumnName>
            <GSTIncluded>N</GSTIncluded>
        </Column>
        <Column>
            <ColumnName>Invoices</ColumnName>
            <GSTIncluded>Y</GSTIncluded>
        </Column>
        <Column>
            <ColumnName>Tax Refund</ColumnName>
            <GSTIncluded>N</GSTIncluded>
            <Values>
                <Value>ATO</Value>
            </Values>
        </Column>
        <Column>
            <ColumnName>Transfers</ColumnName>
            <GSTIncluded>N</GSTIncluded>
            <Values>
                <Value>PAYMENT RECEIVED</Value>
                <Value>Mastercard Payment</Value>
            </Values>
        </Column>
    </IncomeColumns>
    <ExpenseColumns>
        <Column>
            <ColumnName>Misc.</ColumnName>
            <GSTIncluded>N</GSTIncluded>
        </Column>
        <Column>
            <ColumnName>Take Away</ColumnName>
            <GSTIncluded>N</GSTIncluded>
            <Values>
                <Value>MCDONALDS</Value>
                <Value>HUNGRY JACKS</Value>
                <Value>KFC</Value>
            </Values>
        </Column>
        <Column>
            <ColumnName>Tools</ColumnName>
            <GSTIncluded>Y</GSTIncluded>
            <Values>
                <Value>REPCO</Value>
                <Value>BUNNINGS</Value>
            </Values>
        </Column>
        <Column>
            <ColumnName>New Home</ColumnName>
            <GSTIncluded>Y</GSTIncluded>
            <Values>
                <Value>SPOTLIGHT</Value>
            </Values>
        </Column>
        <Column>
            <ColumnName>Petrol and Toll</ColumnName>
            <GSTIncluded>Y</GSTIncluded>
            <Values>
                <Value>EG GROUP</Value>
                <Value>MYKI</Value>
                <Value>TOYOTA</Value>
                <Value>EASTLINK</Value>
                <Value>PAYSTAY</Value>
                <Value>VICROADS</Value>
                <Value>7-ELEVEN</Value>
                <Value>COLES</Value>
                <Value>EXPRESS</Value>
                <Value>DANDENONG</Value>
            </Values>
        </Column>
        <Column>
            <ColumnName>Utilities</ColumnName>
            <GSTIncluded>N</GSTIncluded>
            <Values>
                <Value>SPOTIFY</Value>
                <Value>CRUNCHYROLL</Value>
                <Value>BELONG</Value>
                <Value>OPTUS</Value>
                <Value>TANGO ENERGY</Value>
                <Value>ENERGYAUSTRALIA</Value>
                <Value>VALLEY WATER</Value>
                <Value>XERO</Value>
            </Values>
        </Column>
        <Column>
            <ColumnName>Groceries</ColumnName>
            <GSTIncluded>N</GSTIncluded>
            <Values>
                <Value>WOOLWORTHS</Value>
                <Value>CHEMIST WAREHOUSE</Value>
                <Value>IGA</Value>
                <Value>KMART</Value>
                <Value>ALDI</Value>
            </Values>
        </Column>
        <Column>
            <ColumnName>Insurance</ColumnName>
            <GSTIncluded>Y</GSTIncluded>
            <Values>
                <Value>ASIC</Value>
                <Value>COMMONWEALTH INSURANCE</Value>
                <Value>ALLIANZ</Value>
                <Value>RACV</Value>
            </Values>
        </Column>
        <Column>
            <ColumnName>Children</ColumnName>
            <GSTIncluded>N</GSTIncluded>
            <Values>
                <Value>PEGS</Value>
                <Value>CAMPION</Value>
                <Value>ALLISON BROWNING</Value>
                <Value>PENLEIGH</Value>
                <Value>HEALTHY PETS</Value>
            </Values>
        </Column>
        <Column>
            <ColumnName>Holiday</ColumnName>
            <GSTIncluded>N</GSTIncluded>
            <Values>
                <Value>GOLD LEAF</Value>
                <Value>ARLBERG</Value>
                <Value>MOUNT BULLER</Value>
                <Value>SKI HIRE</Value>
                <Value>EUROA</Value>
                <Value>FAMILY DNTL</Value>
                <Value>CENTRELINK</Value>
            </Values>
        </Column>
    </ExpenseColumns>
</Columns>